{
  "$schema": "./schemas/questionnaire.schema.json",
  "artifactType": "questionnaire_v2",
  "releaseId": "lexy-r0-2026-09-12",
  "version": "1.0.0-draft.1",
  "effectiveFrom": null,
  "effectiveTo": null,
  "updatedBy": "Manus AI",
  "updatedAt": "2026-09-12T18:40:24Z",
  "sourceCommit": "78e2f89e99340a403ce389eada223da6bf336676",
  "status": "draft_pending_legal_approval",
  "reviewStatus": {
    "reviewedByLawyer": false,
    "statement": "Конфигурация не проверена и не утверждена юристом."
  },
  "source": {
    "repository": "dreidmanr/Neolex",
    "commit": "78e2f89e99340a403ce389eada223da6bf336676",
    "file": "shared/paidDiagnosticData.ts",
    "anketaVersion": "v1",
    "priceRub": 4900,
    "questionCount": 63,
    "contentHashSha256": "e926bcacb254a7cabbf58610673a0ddd143c2904611f7ee5c5b6089af167bc26"
  },
  "releaseFlags": {
    "release0": {
      "state": "согласовано_к_началу",
      "architectureOnly": true,
      "runtimeIntegration": false
    },
    "release1Pilot": {
      "state": "запланирован_не_включен",
      "enabledNow": false,
      "activeCoreQuestions": 33,
      "activeBranchQuestions": 6
    },
    "clientAccess": {
      "currentAccessChange": "не_изменяется",
      "statement": "Клиентский доступ не закрывается; этот архитектурный артефакт не подключён к runtime и не меняет действующие маршруты, React, БД, PDF или бизнес-логику."
    }
  },
  "interpretation": {
    "normativeRequirements": [
      {
        "id": "REQ-TZ-8-1",
        "type": "нормативное_требование",
        "source": "ТЗ §8.1",
        "text": "Если для корректного вывода требуется более 15 дополнительных вопросов, должен формироваться флаг manual_follow_up_required и применяться сценарий дозапроса документов или экспертной проверки."
      },
      {
        "id": "REQ-TZ-9-2",
        "type": "нормативное_требование",
        "source": "ТЗ §9.2",
        "text": "В Release 1 включается подмножество 28–35 вопросов ядра и 5–8 наиболее частых веточных вопросов; вопросы, являющиеся входами критических триггеров, обязаны входить в подмножество."
      },
      {
        "id": "REQ-TZ-10-11",
        "type": "нормативное_требование",
        "source": "ТЗ §§10–11",
        "text": "Формулировки и варианты вопросов обязательной анкеты и дополнительных веток не удаляются из конфигурации; изменения требуют новой версии questionnaire_v2."
      }
    ],
    "projectDecisions": [
      {
        "id": "DEC-R0-01",
        "type": "проектное_решение",
        "text": "Release 0 фиксирует конфигурацию отдельно от runtime. Конфигурация содержит все 63 исходных вопроса и не меняет действующую бизнес-логику."
      },
      {
        "id": "DEC-R1-01",
        "type": "проектное_решение",
        "text": "Для запланированного закрытого Pilot Release 1 выбрано ровно 33 активных вопроса core и 6 активных вопросов branch; остальные вопросы физически сохранены с activeInPilot=false."
      },
      {
        "id": "DEC-R1-02",
        "type": "проектное_решение",
        "text": "Для каждого входа критического триггера исходной анкеты установлен признак criticalInputMetadata и такой вопрос включён в активное ядро Release 1."
      },
      {
        "id": "DEC-R0-02",
        "type": "проектное_решение",
        "text": "Текущий клиентский доступ не закрывается. Эта конфигурация имеет архитектурный статус и не является runtime-переключателем."
      }
    ],
    "openQuestions": [
      {
        "id": "OPEN-LEGAL-01",
        "type": "открытый_вопрос",
        "text": "Требуется юридическое согласование классификации core/branch, состава Pilot Release 1, причин эскалации и формулировок до подключения конфигурации к серверной валидации."
      },
      {
        "id": "OPEN-PRODUCT-01",
        "type": "открытый_вопрос",
        "text": "Не определён момент включения Release 1 и критерий активации отключённых вопросов после fixture-тестов и анализа completion rate."
      }
    ]
  },
  "release1Selection": {
    "activeCoreQuestionIds": [
      "b1_q1",
      "b1_q2",
      "b1_q3",
      "b1_q4",
      "b1_q5",
      "b1_q6",
      "b2_q1",
      "b2_q2",
      "b2_q3",
      "b2_q5",
      "b3_q1",
      "b3_q2",
      "b3_q3",
      "b4_q2",
      "b4_q3",
      "b4_q7",
      "b5_q1",
      "b5_q2",
      "b5_q3",
      "b5_q4",
      "b5_q6",
      "b6_q1",
      "b6_q2",
      "b7_q1",
      "b7_q4",
      "b8_q2",
      "b10_q1",
      "b10_q2",
      "b11_q1",
      "b11_q2",
      "b11_q4",
      "b12_q1",
      "b12_q3"
    ],
    "activeBranchQuestionIds": [
      "b8_q1",
      "b8_q3",
      "b9_q1",
      "b9_q2",
      "b9_q3",
      "b12_q2"
    ],
    "selectionRationale": "Состав соответствует проектному диапазону ТЗ §9.2 и включает все 24 исходных вопроса, содержащих критические варианты ответов; это проектное решение, ожидающее юридического согласования."
  },
  "branches": [
    {
      "id": "consumer",
      "title": "Потребительская модель и интерфейсные практики",
      "activeInPilot": true,
      "questionIds": [
        "b8_q1",
        "b8_q3"
      ],
      "activation": {
        "sourceQuestionId": "b1_q3",
        "answerOptionIds": [
          "b2c"
        ]
      }
    },
    {
      "id": "partners",
      "title": "Партнёры, посредники и интеграции",
      "activeInPilot": true,
      "questionIds": [
        "b9_q1",
        "b9_q2",
        "b9_q3"
      ],
      "activation": {
        "sourceQuestionId": "b3_q2",
        "answerOptionIds": [
          "partners"
        ]
      }
    },
    {
      "id": "dispute_detail",
      "title": "Уточнение областей спора",
      "activeInPilot": true,
      "questionIds": [
        "b12_q2"
      ],
      "activation": {
        "sourceQuestionId": "b12_q1",
        "answerOptionIds": [
          "yes"
        ]
      }
    },
    {
      "id": "investment",
      "title": "Подготовка к инвестициям или продаже бизнеса",
      "activeInPilot": false,
      "questionIds": [
        "b14_q1",
        "b14_q2",
        "b14_q3"
      ],
      "activation": {
        "sourceQuestionId": "b1_q5",
        "answerOptionIds": [
          "pre_investment",
          "pre_sale"
        ]
      }
    },
    {
      "id": "contractors",
      "title": "Внешняя разработка и ключевые доступы",
      "activeInPilot": false,
      "questionIds": [
        "b11_q3"
      ],
      "activation": {
        "sourceQuestionId": "b4_q1",
        "answerOptionIds": [
          "contractors",
          "outsource"
        ]
      }
    }
  ],
  "disabledBranchTriggerPolicy": {
    "action": "manual_follow_up_required",
    "reason": "ветка не активна в текущей версии анкеты",
    "triggerPolicies": [
      {
        "id": "trigger_b1_q3_b2c",
        "sourceQuestionId": "b1_q3",
        "sourceAnswerOptionId": "b2c",
        "legacyBranchTrigger": "block_consumer",
        "targetBranchId": "consumer",
        "targetQuestionIds": [
          "b8_q1",
          "b8_q3"
        ],
        "branchActiveInPilot": true,
        "onTrigger": [
          {
            "action": "activate_questions",
            "questionIds": [
              "b8_q1",
              "b8_q3"
            ]
          }
        ]
      },
      {
        "id": "trigger_b1_q5_pre_investment",
        "sourceQuestionId": "b1_q5",
        "sourceAnswerOptionId": "pre_investment",
        "legacyBranchTrigger": "block_investment",
        "targetBranchId": "investment",
        "targetQuestionIds": [
          "b14_q1",
          "b14_q2",
          "b14_q3"
        ],
        "branchActiveInPilot": false,
        "onTrigger": [
          {
            "action": "manual_follow_up_required",
            "reason": "ветка не активна в текущей версии анкеты"
          }
        ]
      },
      {
        "id": "trigger_b1_q5_pre_sale",
        "sourceQuestionId": "b1_q5",
        "sourceAnswerOptionId": "pre_sale",
        "legacyBranchTrigger": "block_investment",
        "targetBranchId": "investment",
        "targetQuestionIds": [
          "b14_q1",
          "b14_q2",
          "b14_q3"
        ],
        "branchActiveInPilot": false,
        "onTrigger": [
          {
            "action": "manual_follow_up_required",
            "reason": "ветка не активна в текущей версии анкеты"
          }
        ]
      },
      {
        "id": "trigger_b3_q2_partners",
        "sourceQuestionId": "b3_q2",
        "sourceAnswerOptionId": "partners",
        "legacyBranchTrigger": "block_partners",
        "targetBranchId": "partners",
        "targetQuestionIds": [
          "b9_q1",
          "b9_q2",
          "b9_q3"
        ],
        "branchActiveInPilot": true,
        "onTrigger": [
          {
            "action": "activate_questions",
            "questionIds": [
              "b9_q1",
              "b9_q2",
              "b9_q3"
            ]
          }
        ]
      },
      {
        "id": "trigger_b4_q1_contractors",
        "sourceQuestionId": "b4_q1",
        "sourceAnswerOptionId": "contractors",
        "legacyBranchTrigger": "block_contractors",
        "targetBranchId": "contractors",
        "targetQuestionIds": [
          "b11_q3"
        ],
        "branchActiveInPilot": false,
        "onTrigger": [
          {
            "action": "manual_follow_up_required",
            "reason": "ветка не активна в текущей версии анкеты"
          }
        ]
      },
      {
        "id": "trigger_b4_q1_outsource",
        "sourceQuestionId": "b4_q1",
        "sourceAnswerOptionId": "outsource",
        "legacyBranchTrigger": "block_contractors",
        "targetBranchId": "contractors",
        "targetQuestionIds": [
          "b11_q3"
        ],
        "branchActiveInPilot": false,
        "onTrigger": [
          {
            "action": "manual_follow_up_required",
            "reason": "ветка не активна в текущей версии анкеты"
          }
        ]
      },
      {
        "id": "trigger_b8_q1_yes",
        "sourceQuestionId": "b8_q1",
        "sourceAnswerOptionId": "yes",